{
  "$schema": "./market-layers.schema.json",
  "schema": "omdsh-market-layers/v2",
  "generatedAt": "2026-08-17T07:22:02.061Z",
  "policy": {
    "pluginCatalog": "catalog.json remains the leaf-plugin authority",
    "installationRegistry": "registry-v1.json remains the only installation authority",
    "infrastructure": "Genuine DSH clients, managers, marketplaces, integrations, and developer tools are displayed separately from leaf plugins.",
    "distribution": "Genuine plugin collections and community distributions are displayed without inheriting installation authority from components.",
    "excluded": "Awesome/documentation, templates/placeholders, and Topic-only traffic matches without a DSH work claim remain outside the market."
  },
  "totals": {
    "projects": 68,
    "infrastructure": 67,
    "distribution": 1
  },
  "projects": [
    {
      "id": "omdsh-dev/dsh-mygo",
      "layer": "infrastructure",
      "name": "dsh-mygo",
      "description": "面向 DSH 生态的插件管理与治理框架，包含核心、CLI、面板和存储扩展。",
      "kind": "manager",
      "category": "infrastructure",
      "tags": [
        "dsh",
        "plugin-manager",
        "ecosystem-infrastructure"
      ],
      "author": {
        "name": "omdsh-dev",
        "url": "https://github.com/omdsh-dev"
      },
      "source": {
        "repository": "https://github.com/omdsh-dev/dsh-mygo",
        "ref": "4566748646823f8e2123f6addcf22b55e305e740",
        "path": null
      },
      "updatedAt": "2026-08-13T07:54:45.000Z",
      "version": "0.0.1-rc.1",
      "license": "MIT",
      "featured": true,
      "discovery": {
        "stars": 3,
        "commitUpdatedAt": "2026-08-13T07:54:45.000Z"
      },
      "review": {
        "state": "curated",
        "reason": "ecosystem-infrastructure"
      },
      "verification": {
        "state": "static-reviewed",
        "evidence": "topic-plugin-audit.json#omdsh-dev/dsh-mygo"
      },
      "registry": {
        "state": "ineligible",
        "reason": "market-layer-not-plugin-install"
      }
    },
    {
      "id": "omdsh-dev/dsh-hub",
      "layer": "infrastructure",
      "name": "DSH Hub",
      "description": "面向终端用户的市场消费端，用于浏览并消费 Workshop 的公共 Feed。",
      "kind": "manager",
      "category": "infrastructure",
      "tags": [
        "dsh",
        "marketplace-consumer",
        "plugin-marketplace"
      ],
      "author": {
        "name": "omdsh-dev",
        "url": "https://github.com/omdsh-dev"
      },
      "source": {
        "repository": "https://github.com/omdsh-dev/dsh-hub",
        "ref": "82c958c945542064cbdf3eeb2bb408f95187bfc0",
        "path": null
      },
      "updatedAt": "2026-08-13T13:18:23.000Z",
      "version": null,
      "license": "Unknown",
      "featured": false,
      "discovery": {
        "stars": 1,
        "commitUpdatedAt": "2026-08-13T13:18:23.000Z"
      },
      "review": {
        "state": "curated",
        "reason": "ecosystem-infrastructure"
      },
      "verification": {
        "state": "source-pinned",
        "evidence": "public GitHub commit"
      },
      "registry": {
        "state": "ineligible",
        "reason": "market-layer-not-plugin-install"
      }
    },
    {
      "id": "omdsh-dev/dsh-hub-workshop",
      "layer": "infrastructure",
      "name": "DSH Hub Workshop",
      "description": "OMDSH 生态的公开目录、审核投影与不可变 Feed 权威源。",
      "kind": "manager",
      "category": "infrastructure",
      "tags": [
        "dsh",
        "catalog",
        "plugin-marketplace",
        "plugin-registry"
      ],
      "author": {
        "name": "omdsh-dev",
        "url": "https://github.com/omdsh-dev"
      },
      "source": {
        "repository": "https://github.com/omdsh-dev/dsh-hub-workshop",
        "ref": "ca595d6c7534d8542232cd7df34e0e921eb4abc3",
        "path": null
      },
      "updatedAt": "2026-08-13T14:09:05.000Z",
      "version": null,
      "license": "Unknown",
      "featured": false,
      "discovery": {
        "stars": 0,
        "commitUpdatedAt": "2026-08-13T14:09:05.000Z"
      },
      "review": {
        "state": "curated",
        "reason": "ecosystem-infrastructure"
      },
      "verification": {
        "state": "source-pinned",
        "evidence": "public GitHub commit"
      },
      "registry": {
        "state": "ineligible",
        "reason": "market-layer-not-plugin-install"
      }
    },
    {
      "id": "omdsh-dev/omdsh",
      "layer": "distribution",
      "name": "Oh My DSH",
      "description": "社区发行版与精确发行清单层，用于组织经过审核的组件组合。",
      "kind": "toolkit",
      "category": "platform",
      "tags": [
        "dsh",
        "distribution",
        "community-release"
      ],
      "author": {
        "name": "omdsh-dev",
        "url": "https://github.com/omdsh-dev"
      },
      "source": {
        "repository": "https://github.com/omdsh-dev/omdsh",
        "ref": "8affdc1b9e7ad3b5e70fc6b7772f7d95ff2384de",
        "path": null
      },
      "updatedAt": "2026-08-13T13:19:16.000Z",
      "version": null,
      "license": "MIT",
      "featured": false,
      "discovery": {
        "stars": 0,
        "commitUpdatedAt": "2026-08-13T13:19:16.000Z"
      },
      "review": {
        "state": "curated",
        "reason": "community-distribution"
      },
      "verification": {
        "state": "source-pinned",
        "evidence": "public GitHub commit"
      },
      "registry": {
        "state": "ineligible",
        "reason": "market-layer-not-plugin-install"
      }
    },
    {
      "id": "omdsh-dev/omdsh-runtime",
      "layer": "infrastructure",
      "name": "OMDSH Runtime",
      "description": "负责 Profile、Bundle、候选代际和恢复语义的无头运行时。",
      "kind": "manager",
      "category": "infrastructure",
      "tags": [
        "dsh",
        "runtime",
        "profile-management"
      ],
      "author": {
        "name": "omdsh-dev",
        "url": "https://github.com/omdsh-dev"
      },
      "source": {
        "repository": "https://github.com/omdsh-dev/omdsh-runtime",
        "ref": "7b63a27edef055a1c35d97d97651e78d41ea8a2f",
        "path": null
      },
      "updatedAt": "2026-08-13T13:18:16.000Z",
      "version": null,
      "license": "Unknown",
      "featured": false,
      "discovery": {
        "stars": 0,
        "commitUpdatedAt": "2026-08-13T13:18:16.000Z"
      },
      "review": {
        "state": "curated",
        "reason": "ecosystem-infrastructure"
      },
      "verification": {
        "state": "source-pinned",
        "evidence": "public GitHub commit"
      },
      "registry": {
        "state": "ineligible",
        "reason": "market-layer-not-plugin-install"
      }
    },
    {
      "id": "ccch1mneyyy/dsh-tui",
      "layer": "infrastructure",
      "name": "dsh-TUI",
      "description": "DSH 官方公众号收录的 TUI 补位插件：Claude Code 风，鲸鱼顶栏/实时状态/流式思考/双击 Esc 回滚/上下文进度+TPS。npm 一键装。  DSH official WeChat featured TUI plugin — Claude Code style: whale bar, live status, streaming thoughts, double-Esc rollback, context bar + TPS. npm one-click.",
      "kind": "application",
      "category": "infrastructure",
      "tags": [
        "dsh",
        "ecosystem-infrastructure"
      ],
      "author": {
        "name": "ccch1mneyyy",
        "url": "https://github.com/ccch1mneyyy"
      },
      "source": {
        "repository": "https://github.com/ccch1mneyyy/dsh-TUI",
        "ref": "main",
        "path": null
      },
      "updatedAt": "2026-08-17T07:18:08Z",
      "version": null,
      "license": "未声明",
      "featured": false,
      "discovery": {
        "stars": 1699,
        "createdAt": "2026-08-13T12:49:31Z",
        "commitUpdatedAt": "2026-08-17T07:18:08Z",
        "metadataUpdatedAt": "2026-08-17T07:17:50Z",
        "archived": false
      },
      "review": {
        "state": "pending-review",
        "reason": "ecosystem-infrastructure"
      },
      "verification": {
        "state": "unverified",
        "evidence": "GitHub Topic metadata and explicit DSH project claim; source review pending"
      },
      "registry": {
        "state": "ineligible",
        "reason": "market-layer-not-plugin-install"
      }
    },
    {
      "id": "huiliyi37/dsh-tianshu-tui",
      "layer": "infrastructure",
      "name": "dsh-tianshu-tui",
      "description": "dsh-tianshu-tui — 是官方 Dsh web端的交互式终端极简风格 UI 插件。以自研ansi为渲染核心，极度丝滑流畅，在官方的基础上增加了TDD、证据门、视觉图像模块等工作流。",
      "kind": "application",
      "category": "infrastructure",
      "tags": [
        "dsh",
        "ecosystem-infrastructure"
      ],
      "author": {
        "name": "huiliyi37",
        "url": "https://github.com/huiliyi37"
      },
      "source": {
        "repository": "https://github.com/huiliyi37/dsh-tianshu-tui",
        "ref": "main",
        "path": null
      },
      "updatedAt": "2026-08-17T05:56:28Z",
      "version": null,
      "license": "未声明",
      "featured": false,
      "discovery": {
        "stars": 196,
        "createdAt": "2026-08-13T04:20:37Z",
        "commitUpdatedAt": "2026-08-17T05:56:28Z",
        "metadataUpdatedAt": "2026-08-17T06:57:47Z",
        "archived": false
      },
      "review": {
        "state": "pending-review",
        "reason": "ecosystem-infrastructure"
      },
      "verification": {
        "state": "unverified",
        "evidence": "GitHub Topic metadata and explicit DSH project claim; source review pending"
      },
      "registry": {
        "state": "ineligible",
        "reason": "market-layer-not-plugin-install"
      }
    },
    {
      "id": "awesome-dsh-plugin/dsh-find-plugin",
      "layer": "infrastructure",
      "name": "dsh-find-plugin",
      "description": "Find DSH plugins inside the agent — live GitHub dsh-plugin topic search, star-ranked / 会话内搜索发现 DSH 插件",
      "kind": "manager",
      "category": "infrastructure",
      "tags": [
        "dsh",
        "ecosystem-infrastructure"
      ],
      "author": {
        "name": "awesome-dsh-plugin",
        "url": "https://github.com/awesome-dsh-plugin"
      },
      "source": {